{
  "registry_version": "1.0.0",
  "status": "engineering_complete_pending_organizational_approval",
  "reviewed_at": "2026-09-03",
  "fetch_defaults": {
    "https_only": true,
    "dns_public_addresses_only": true,
    "connect_timeout_seconds": 10,
    "read_timeout_seconds": 30,
    "max_redirects": 3,
    "max_bytes": 10485760,
    "user_agent": "SmartNudgeResearch/0.2 (+manual-public-web-research; contact-required-before-production)"
  },
  "sources": [
    {
      "source_id": "hk-ia-publications",
      "name": "Insurance Authority public information",
      "organization": "Insurance Authority (Hong Kong)",
      "market_ids": ["HK"],
      "languages": ["zh-Hant", "en"],
      "topic_ids": ["regulatory-change", "reputation-and-conduct"],
      "source_type": "regulator",
      "search_mode": "trusted_registry",
      "trust": {
        "tier": "primary",
        "scope": ["IA-authored regulatory instruments and announcements"],
        "exclusions": ["third-party material", "search snippets", "business impact inference"]
      },
      "access": {
        "status": "manual_review_only",
        "automated_content_access": false,
        "authentication": "none",
        "rate_policy": "No automated content requests until explicit permission or a verified publisher path exists.",
        "robots_review": {"status": "reviewed", "reviewed_at": "2026-09-03", "notes": "Publisher policy reviewed; a representative page denied automated retrieval with HTTP 403. Stop without bypass."}
      },
      "rights": {
        "retention": "approved_metadata_only",
        "excerpt_retention": "prior_written_consent_required",
        "fulltext_retention": "prior_written_consent_required",
        "commercial_use": "not_permitted_without_written_permission",
        "attribution": [],
        "policy_urls": ["https://www.ia.org.hk/en/policies/policies.html"],
        "notes": "The P1 publisher override controls: preserve only approved metadata and the native URL."
      },
      "methods": [
        {"kind": "manual", "entry_url": "https://www.ia.org.hk/en/infocenter/", "host": "www.ia.org.hk", "path_prefixes": ["/en/infocenter/", "/en/legislative_framework/", "/tc/infocenter/", "/tc/legislative_framework/"], "content_types": ["text/html", "application/pdf"]}
      ],
      "verification": {
        "last_verified": "2026-09-03",
        "verification_method": "publisher policy review and representative access test recorded in P1",
        "evidence_urls": ["https://www.ia.org.hk/en/policies/policies.html", "https://www.ia.org.hk/en/infocenter/press_releases/20240701.html"],
        "coverage_limitations": ["Automated original-text access is disabled.", "Manual review does not establish systematic or complete coverage."]
      }
    },
    {
      "source_id": "hk-hkma-publications",
      "name": "HKMA press releases and publications",
      "organization": "Hong Kong Monetary Authority",
      "market_ids": ["HK"],
      "languages": ["zh-Hant", "zh-Hans", "en"],
      "topic_ids": ["regulatory-change", "capital-and-alm", "reputation-and-conduct"],
      "source_type": "regulator",
      "search_mode": "trusted_registry",
      "trust": {
        "tier": "primary",
        "scope": ["HKMA-authored press releases, circulars, regulatory and statistical material"],
        "exclusions": ["third-party linked material", "application to insurance entities unless stated"]
      },
      "access": {
        "status": "approved_automated",
        "automated_content_access": true,
        "authentication": "none",
        "rate_policy": "Exact registered paths, low volume, serial requests; stop if requested by HKMA.",
        "robots_review": {"status": "not_applicable_api", "reviewed_at": "2026-09-03", "notes": "The preferred machine path is the documented HKMA public API; website documents remain constrained by the same terms."}
      },
      "rights": {
        "retention": "approved_metadata_only",
        "excerpt_retention": "organizational_approval_required_for_corporate_work_product",
        "fulltext_retention": "prior_written_permission_required",
        "commercial_use": "not_confirmed",
        "attribution": ["Hong Kong Monetary Authority"],
        "policy_urls": ["https://brdr.hkma.gov.hk/eng/terms-and-conditions"],
        "notes": "Terms explicitly cover HKMA APIs, but broad corporate reuse is not assumed; default to metadata-only retention."
      },
      "methods": [
        {"kind": "api", "entry_url": "https://api.hkma.gov.hk/public/press-releases?lang=en", "host": "api.hkma.gov.hk", "path_prefixes": ["/public/press-releases"], "content_types": ["application/json"]},
        {"kind": "html", "entry_url": "https://www.hkma.gov.hk/eng/news-and-media/press-releases/", "host": "www.hkma.gov.hk", "path_prefixes": ["/eng/news-and-media/", "/chi/news-and-media/", "/eng/key-functions/", "/chi/key-functions/"], "content_types": ["text/html", "application/pdf"]}
      ],
      "verification": {
        "last_verified": "2026-09-03",
        "verification_method": "official API documentation and terms review",
        "evidence_urls": ["https://apidocs.hkma.gov.hk/chi/documentation/press-releases/", "https://brdr.hkma.gov.hk/eng/terms-and-conditions"],
        "coverage_limitations": ["Press-release API is not a complete index of all HKMA instruments.", "Insurance-sector rules generally require the Insurance Authority path as well."]
      }
    },
    {
      "source_id": "hk-sfc-publications",
      "name": "SFC news, circulars and consultation material",
      "organization": "Securities and Futures Commission",
      "market_ids": ["HK"],
      "languages": ["zh-Hant", "en"],
      "topic_ids": ["regulatory-change", "competitive-distribution", "reputation-and-conduct"],
      "source_type": "regulator",
      "search_mode": "trusted_registry",
      "trust": {
        "tier": "primary",
        "scope": ["SFC-authored regulatory, enforcement, consultation and announcement material"],
        "exclusions": ["third-party linked material", "insurance obligations outside SFC remit"]
      },
      "access": {
        "status": "approved_automated",
        "automated_content_access": true,
        "authentication": "none",
        "rate_policy": "Exact registered paths, low volume and serial requests; cease on access denial.",
        "robots_review": {"status": "reviewed", "reviewed_at": "2026-09-03", "notes": "Official RSS availability and public HTML document delivery were verified; no bulk traversal is approved."}
      },
      "rights": {
        "retention": "approved_metadata_only",
        "excerpt_retention": "few_relevant_paragraphs_only_with_attribution_and_separate_work_product_check",
        "fulltext_retention": "prior_written_permission_required",
        "commercial_use": "internal_view_only",
        "attribution": ["Securities and Futures Commission, Hong Kong"],
        "policy_urls": ["https://www.sfc.hk/en/Quick-links/Others/Disclaimer", "https://www.sfc.hk/en/Quick-links/Others/Hyperlink-policy"],
        "notes": "Internal firm viewing is allowed; downstream reproduction and commercial use remain restricted."
      },
      "methods": [
        {"kind": "html", "entry_url": "https://www.sfc.hk/en/News-and-announcements", "host": "www.sfc.hk", "path_prefixes": ["/en/News-and-announcements", "/TC/News-and-announcements", "/en/Rules-and-standards/", "/TC/Rules-and-standards/"], "content_types": ["text/html", "application/pdf", "application/rss+xml"]},
        {"kind": "html", "entry_url": "https://apps.sfc.hk/edistributionWeb/gateway/EN/news-and-announcements/news/", "host": "apps.sfc.hk", "path_prefixes": ["/edistributionWeb/gateway/EN/", "/edistributionWeb/gateway/TC/"], "content_types": ["text/html", "application/pdf"]}
      ],
      "verification": {
        "last_verified": "2026-09-03",
        "verification_method": "official RSS page, disclaimer and representative official document review",
        "evidence_urls": ["https://www.sfc.hk/en/RSS-Feeds", "https://www.sfc.hk/en/Quick-links/Others/Disclaimer", "https://apps.sfc.hk/edistributionWeb/gateway/EN/news-and-announcements/news/doc?refNo=26PR51"],
        "coverage_limitations": ["Direct RSS feed URLs were not promoted to the registry because the review did not establish a stable endpoint.", "Coverage is limited to registered public sections."]
      }
    },
    {
      "source_id": "hk-government-announcements",
      "name": "Hong Kong Government announcements and FSTB discovery paths",
      "organization": "Government of the Hong Kong SAR",
      "market_ids": ["HK"],
      "languages": ["zh-Hant", "zh-Hans", "en"],
      "topic_ids": ["regulatory-change", "capital-and-alm", "health-economics", "growth-and-innovation"],
      "source_type": "government",
      "search_mode": "trusted_registry",
      "trust": {
        "tier": "primary",
        "scope": ["HKSARG-authored announcements and department publications"],
        "exclusions": ["third-party copyright material", "department attribution not confirmed by the item"]
      },
      "access": {
        "status": "approved_automated",
        "automated_content_access": true,
        "authentication": "none",
        "rate_policy": "Use documented DATA.GOV.HK feed/API for discovery and exact public paths for validation; no site crawl.",
        "robots_review": {"status": "not_applicable_api", "reviewed_at": "2026-09-03", "notes": "Preferred acquisition is the official DATA.GOV.HK feed/API. Department-site direct automation is not enabled by this source."}
      },
      "rights": {
        "retention": "approved_metadata_only",
        "excerpt_retention": "organizational_approval_required_for_corporate_work_product",
        "fulltext_retention": "prior_written_permission_required_unless_item_license_explicitly_allows",
        "commercial_use": "not_confirmed",
        "attribution": ["Government of the Hong Kong SAR", "originating department shown on the item"],